{
  "id": "refdoc-fixture-001",
  "title": "Quyết định phê duyệt chủ trương đầu tư (fixture)",
  "issuingAuthority": "UBND tỉnh Đắk Lắk (fixture)",
  "documentNumber": "999/QD-UBND-fixture",
  "issuedDate": "2025-11-01",
  "legalStatus": "in-effect",
  "sourceDatasetId": "project-portfolio-generated-fixture-demo"
}
